{
  "schemaVersion": "0.1.0",
  "implementation": "dotnet",
  "version": "1.0.0-beta.3.1",
  "protocolTag": "v0.2.0",
  "producedAt": "2026-09-16T01:50:47.513Z",
  "runLog": "conformance/results/dotnet-1.0.0-beta.3.1.json (Sakwala/affiant)",
  "failing": [],
  "adapters": [],
  "runtimes": [
    {
      "name": "net10.0",
      "version": "10.0",
      "claimed": true,
      "unicodeVersion": "16.0"
    }
  ],
  "exemptions": [
    {
      "rule": "SR-5",
      "until": "always",
      "reason": "exempt by construction: the transport is not the protocol; the negative case is the set of host-shaped seed examples no rule cites as a check",
      "checkedInstead": "the wire-shape suites in Sakwala/affiant-host-apps, which compare each host payload's key set against the shipped serializer"
    },
    {
      "rule": "AF-5",
      "until": "always",
      "reason": "a schema-level rule: checked by the schema lint over the tool-result fixtures and a type-level suite, not by a declarative gate fixture",
      "checkedInstead": "the Affiant.Abstractions.Tests suite over the tool-result envelope types"
    },
    {
      "rule": "SR-3",
      "until": "always",
      "reason": "a schema-level rule: checked by the schema lint over every fixture",
      "checkedInstead": "the fixture lint in the rulebook, run over every vendored fixture by conformance/sync.sh --verify"
    },
    {
      "rule": "RT-1",
      "until": "always",
      "reason": "a runtime rule: checked by the three-runtime CI matrix and a no-Node-types type-check of the core sources",
      "checkedInstead": "not claimed beyond one runtime: this implementation targets net10.0 only, and the manifest names that one runtime"
    },
    {
      "rule": "RT-2",
      "until": "always",
      "reason": "a runtime rule: checked by a budget suite on the implementation's own CI",
      "checkedInstead": "no per-request resource budget suite exists in this repository yet"
    },
    {
      "rule": "RT-3",
      "until": "always",
      "reason": "a runtime rule: checked by a source lint that fails the build",
      "checkedInstead": "the public-API baselines (Microsoft.CodeAnalysis.PublicApiAnalyzers) plus TreatWarningsAsErrors, which fail the build on an undeclared public member"
    },
    {
      "rule": "TL-1",
      "until": "always",
      "reason": "a registry rule: checked by the registry-integrity suite and by every fixture that asserts telemetry",
      "checkedInstead": "the Affiant.Core.Tests observability suite over AffiantTelemetry; see the note on the disjoint key sets"
    },
    {
      "rule": "TL-2",
      "until": "always",
      "reason": "a registry rule: checked by the attribute-name suite against the published standards",
      "checkedInstead": "no substitute: the framework's telemetry attribute names are not checked against the published standards"
    }
  ],
  "notes": "The .NET conformance driver, run by this repository's own test suite against the packages this tree builds, read at the rulebook's v0.2.0. ALL SIXTY-EIGHT DOCUMENTS PASS -- the sixty-one declarative fixtures and the seven canonical byte vectors -- so the failing list is empty, which is what this release's acceptance asks for. Five things a reader of this document alone should know. (0) WHAT THE PIN MOVING TO v0.2.0 CHANGED HERE, AND WHAT IT DID NOT. Nothing this driver runs changed: v0.2.0 adds no wire shape, no schema under schemas/0.1.0, no canonical vector and no conformance fixture, so the sixty-eight documents are the sixty-eight read at v0.1.3, and no code in this repository moved with the pin. What it adds is a SECOND fixture section, `adapter`, scoped at the section level: a driver runs it once for every adapter its implementation ships and declares to the rulebook, and one that declares none runs none of it and says so with `adapters: []` -- which is what this manifest does. The declaration the rulebook reads is an npm package's `affiant.adapter` block, and no package here has one. The three exemptions that read `until: 0.2.0` -- CV-2, CV-3 and CV-5 -- were lifted at that tag when the first adapter arrived, so this manifest inherits eight rulebook exemptions where the v0.1 readings inherited eleven; those readings are correct about their own ref and are not restated here. (1) WHAT THIS RUN IS. It is a run of the default branch at the commit the run log names, which builds 1.0.0-beta.3.1. That version HAS shipped -- ten NuGet packages, 2026-09-09 -- and the branch has taken changes since the tag, so this is a reading of the branch rather than a re-reading of the released artefacts. The five fixtures the rulebook's negative oracle lists against the SHIPPED 1.0.0-beta.3 -- the four PV-3 fixtures authored at v0.1.3 and sequence-a/picker-external-binding -- pass here, which is the half of that oracle this repository is responsible for: the release they were listed against fails them, and the branch that fixes Sakwala/affiant#123 passes them. (2) PRESENCE IS ESTABLISHED FROM THE UTTERANCE. PV-3 at v0.1.3 grades an inferred field Conversation when the value is literally present in the turn, and that is a property of two strings: this implementation locates the value's text in the utterance itself under an ASCII-only case fold, and a port's presence and utteranceSpan are hints it verifies the same way. The driver passes given.ctx.utterance to the inference step, and the empty string where a fixture states none, so the finder is what the suite measures. The neighbour test reads General_Category from this runtime's own Unicode database; the version it carries is stated in `runtimes`. (3) THE CANONICAL FORM AND THE ENTRY ID ARE THE PROTOCOL'S. Every byte vector is reproduced through the SHIPPED serializer -- the same exported helper a host calls to mint an execution grant -- and never through a canonicaliser written beside the test: the rule says a driver reproduces the bytes and the digest rather than re-deriving them. The amended vector's sworn form is folded by the shipped amendment fold and checked against the accepted state the vector writes down before its bytes are compared, and every vector is validated against canonical-vector.schema.json before it runs. The form is over the Affidavit as the schema defines it, protocol version included (SR-1). A Docket entry id is derived from the tenant, the conversation, the tool and the canonical form of the operation and its arguments, digested and laid out as GT-4 states, so an id minted here and an id minted by another implementation for the same proposal are the same id -- which they must be, because the id travels inside the record and therefore inside the hash a grant binds to. (4) WHAT THE DRIVER CHECKS WITHOUT BEING ASKED. Every filing a fixture performs -- prior steps included -- is card-checked: the card points at its row, carries that row's deadline and protocol version, repeats the record's three confidence numbers, and says on its face when the row is blocked. Every attestation is checked to name the entry it attests to. `wrap-execute` runs the shipped tool-wrapping pipeline rather than a restatement of it, and the driver's README names the entry point each of the eight step kinds is bound to."
}
