{
  "schemaVersion": "0.1.0",
  "implementation": "dotnet",
  "version": "1.0.0-beta.3.1",
  "protocolTag": "v0.1.3",
  "producedAt": "2026-09-08T16:55:34.149Z",
  "runLog": "conformance/results/dotnet-1.0.0-beta.3.1.json (Sakwala/affiant)",
  "failing": [],
  "runtimes": [
    {
      "name": "net10.0",
      "version": "10.0",
      "claimed": true,
      "unicodeVersion": "16.0"
    }
  ],
  "exemptions": [
    {
      "rule": "SR-5",
      "until": "always",
      "reason": "exempt by construction: the transport is not the protocol; the negative case is the set of host-shaped seed examples no rule cites as a check",
      "checkedInstead": "the wire-shape suites in Sakwala/affiant-host-apps, which compare each host payload's key set against the shipped serializer"
    },
    {
      "rule": "CV-2",
      "until": "0.2.0",
      "reason": "text complete at v0.1; the call-site fixtures arrive with the first adapter",
      "checkedInstead": "no substitute yet: the adapter call-site fixtures arrive with the rulebook's v0.2"
    },
    {
      "rule": "CV-3",
      "until": "0.2.0",
      "reason": "text complete at v0.1; the delegation fixtures arrive with the first adapter",
      "checkedInstead": "no substitute yet: the delegation fixtures arrive with the rulebook's v0.2"
    },
    {
      "rule": "CV-5",
      "until": "0.2.0",
      "reason": "text complete at v0.1; an adapter documentation lint arrives with the first adapter",
      "checkedInstead": "no substitute yet: the adapter documentation lint arrives with the rulebook's v0.2"
    },
    {
      "rule": "AF-5",
      "until": "always",
      "reason": "a schema-level rule: checked by the schema lint over the tool-result fixtures and a type-level suite, not by a declarative gate fixture",
      "checkedInstead": "the Affiant.Abstractions.Tests suite over the tool-result envelope types"
    },
    {
      "rule": "SR-3",
      "until": "always",
      "reason": "a schema-level rule: checked by the schema lint over every fixture",
      "checkedInstead": "the fixture lint in the rulebook, run over every vendored fixture by conformance/sync.sh --verify"
    },
    {
      "rule": "RT-1",
      "until": "always",
      "reason": "a runtime rule: checked by the three-runtime CI matrix and a no-Node-types type-check of the core sources",
      "checkedInstead": "not claimed beyond one runtime: this implementation targets net10.0 only, and the manifest names that one runtime"
    },
    {
      "rule": "RT-2",
      "until": "always",
      "reason": "a runtime rule: checked by a budget suite on the implementation's own CI",
      "checkedInstead": "no per-request resource budget suite exists in this repository yet"
    },
    {
      "rule": "RT-3",
      "until": "always",
      "reason": "a runtime rule: checked by a source lint that fails the build",
      "checkedInstead": "the public-API baselines (Microsoft.CodeAnalysis.PublicApiAnalyzers) plus TreatWarningsAsErrors, which fail the build on an undeclared public member"
    },
    {
      "rule": "TL-1",
      "until": "always",
      "reason": "a registry rule: checked by the registry-integrity suite and by every fixture that asserts telemetry",
      "checkedInstead": "the Affiant.Core.Tests observability suite over AffiantTelemetry; see the note on the disjoint key sets"
    },
    {
      "rule": "TL-2",
      "until": "always",
      "reason": "a registry rule: checked by the attribute-name suite against the published standards",
      "checkedInstead": "no substitute: the framework's telemetry attribute names are not checked against the published standards"
    }
  ],
  "notes": "The .NET conformance driver, run by this repository's own test suite against the packages this tree builds, read at the rulebook's v0.1.3. ALL SIXTY-EIGHT DOCUMENTS PASS -- the sixty-one declarative fixtures and the seven canonical byte vectors -- so the failing list is empty, which is what this release's acceptance asks for. Four things a reader of this document alone should know. (1) WHAT THIS RUN IS. It is a BRANCH BUILD of the 1.0.0-beta.3.1 candidate, not a shipped release: the version here names what the tree builds, and nothing carrying it has been published. The five fixtures the rulebook's negative oracle lists against the SHIPPED 1.0.0-beta.3 -- the four PV-3 fixtures authored at v0.1.3 and sequence-a/picker-external-binding -- pass here, which is the half of that oracle this repository is responsible for: the release they were listed against fails them, and the branch that fixes Sakwala/affiant#123 passes them. (2) PRESENCE IS ESTABLISHED FROM THE UTTERANCE. PV-3 at v0.1.3 grades an inferred field Conversation when the value is literally present in the turn, and that is a property of two strings: this implementation locates the value's text in the utterance itself under an ASCII-only case fold, and a port's presence and utteranceSpan are hints it verifies the same way. The driver passes given.ctx.utterance to the inference step, and the empty string where a fixture states none, so the finder is what the suite measures. The neighbour test reads General_Category from this runtime's own Unicode database; the version it carries is stated in `runtimes`. (3) THE CANONICAL FORM AND THE ENTRY ID ARE THE PROTOCOL'S. Every byte vector is reproduced through the SHIPPED serializer -- the same exported helper a host calls to mint an execution grant -- and never through a canonicaliser written beside the test: the rule says a driver reproduces the bytes and the digest rather than re-deriving them. The amended vector's sworn form is folded by the shipped amendment fold and checked against the accepted state the vector writes down before its bytes are compared, and every vector is validated against canonical-vector.schema.json before it runs. The form is over the Affidavit as the schema defines it, protocol version included (SR-1). A Docket entry id is derived from the tenant, the conversation, the tool and the canonical form of the operation and its arguments, digested and laid out as GT-4 states, so an id minted here and an id minted by another implementation for the same proposal are the same id -- which they must be, because the id travels inside the record and therefore inside the hash a grant binds to. (4) WHAT THE DRIVER CHECKS WITHOUT BEING ASKED. Every filing a fixture performs -- prior steps included -- is card-checked: the card points at its row, carries that row's deadline and protocol version, repeats the record's three confidence numbers, and says on its face when the row is blocked. Every attestation is checked to name the entry it attests to. `wrap-execute` runs the shipped tool-wrapping pipeline rather than a restatement of it, and the driver's README names the entry point each of the eight step kinds is bound to."
}
